paper_id,doi,title,year,startpp,endpp,cited,issue_no,pdf_url,paper_type,title_pro,abstract,abstract_pro
15472450.2012.716663,10.1080/15472450.2012.716663,Augmented Betweenness Centrality for Environmentally Aware Traffic Monitoring in Transportation Networks,2013,91,105,40,2013-17-1,https://www.tandfonline.com/doi/full/10.1080/15472450.2012.716663,regular,augmented betweenness centrality for environmentally aware traffic monitoring in transportation networks,"Network planning and traffic flow optimization require the acquisition and analysis of large quantities of data such as the network topology, its traffic flow data, vehicle fleet composition, emission measurements and so on. Data acquisition is an expensive process that involves household surveys and automatic as well as semiautomatic measurements performed all over the network. For example, in order to accurately estimate the effect of a certain network change on the total emissions produced by vehicles in the network, assessment of the vehicle fleet composition for each origin–destination pair is required. As a result, problems that optimize nonlocal merit functions become highly difficult to solve. One such problem is finding the optimal deployment of traffic monitoring units. In this article we suggest a new traffic assignment model that is based on the concept of shortest path betweenness centrality measure, borrowed from the domain of complex network analysis. We show how betweenness can be augmented in order to solve the traffic assignment problem given an arbitrary travel cost definition. The proposed traffic assignment model is evaluated using a high-resolution Israeli transportation data set derived from the analysis of cellular phones data. The group variant of the augmented betweenness centrality is then used to optimize the locations of traffic monitoring units, hence reducing the cost and increasing the effectiveness of traffic monitoring.",network planning and traffic flow optimization require the acquisition and analysis of large quantities of data such as the network topology its traffic flow data vehicle fleet composition emission measurements and so on data acquisition is an expensive process that involves household surveys and automatic as well as semiautomatic measurements performed all over the network for example in order to accurately estimate the effect of a certain network change on the total emissions produced by vehicles in the network assessment of the vehicle fleet composition for each origindestination pair is required as a result problems that optimize nonlocal merit functions become highly difficult to solve one such problem is finding the optimal deployment of traffic monitoring units in this article we suggest a new traffic assignment model that is based on the concept of shortest path betweenness centrality measure borrowed from the domain of complex network analysis we show how betweenness can be augmented in order to solve the traffic assignment problem given an arbitrary travel cost definition the proposed traffic assignment model is evaluated using a highresolution israeli transportation data set derived from the analysis of cellular phones data the group variant of the augmented betweenness centrality is then used to optimize the locations of traffic monitoring units hence reducing the cost and increasing the effectiveness of traffic monitoring
15472450.2013.784653,10.1080/15472450.2013.784653,Microscopic Modeling of Control Delay at Signalized Intersections Based on Bluetooth Data,2013,110,122,5,2013-17-2,https://www.tandfonline.com/doi/full/10.1080/15472450.2013.784653,regular,microscopic modeling of control delay at signalized intersections based on bluetooth data,"Bluetooth media access control (MAC) identification (ID) detection has been effectively used for near real-time traffic monitoring. Its continuous data collection capability by sampling actual traffic makes it feasible for permanent installation in the road with minimal cost and better data accuracy, both qualitatively and quantitatively. However, the delay calculated with simple matching of MAC IDs has some inherent errors due to the frequency hopping structure of Bluetooth detections. The detections of a Bluetooth device in a traveling vehicle can be thought of as random events varying in space and time. This article presents two models to calculate traffic control delay based on synchronized Bluetooth and global positioning system (GPS) probe vehicle data. The two models are based on the number of Bluetooth observed detections and the time duration between the first and the last detections. The proposed models were found to be more accurate than the existing practice and have the potential to be used for estimating intersection approach level-of-service (LOS) in near real time for evaluating and optimizing signal timing plans.",bluetooth media access control  identification  detection has been effectively used for near realtime traffic monitoring its continuous data collection capability by sampling actual traffic makes it feasible for permanent installation in the road with minimal cost and better data accuracy both qualitatively and quantitatively however the delay calculated with simple matching of mac ids has some inherent errors due to the frequency hopping structure of bluetooth detections the detections of a bluetooth device in a traveling vehicle can be thought of as random events varying in space and time this article presents two models to calculate traffic control delay based on synchronized bluetooth and global positioning system  probe vehicle data the two models are based on the number of bluetooth observed detections and the time duration between the first and the last detections the proposed models were found to be more accurate than the existing practice and have the potential to be used for estimating intersection approach levelofservice  in near real time for evaluating and optimizing signal timing plans
15472450.2012.696452,10.1080/15472450.2012.696452,Antenna Characterization for Bluetooth-Based Travel Time Data Collection,2013,142,151,23,2013-17-2,https://www.tandfonline.com/doi/full/10.1080/15472450.2012.696452,regular,antenna characterization for bluetooth based travel time data collection,"Several approaches for travel time data collection based on the reading of time-stamped media access control addresses from Bluetooth-enabled devices have been reported in the literature recently. This new approach offers a number of advantages over more conventional methods, including lower costs of hardware and software, the volume of data that can be collected over time, and ease of implementation. A fundamental component that may affect the quantity and the quality of the travel time samples collected with a Bluetooth-based system is the antenna type utilized. Antenna characteristics such as polarization and gain must be matched to specific application environments to optimize the performance of a Bluetooth reader unit. However, experimental data that focuses on antenna characterization as it relates to the use of Bluetooth technology to assess the performance of transportation facilities is lacking. In this study, five different types of antennas were characterized to assess their suitability to support a Bluetooth-based travel time data collection system. The results indicate that vertically polarized antennas with gains between 9dBi and 12dBi are good candidates for travel time data collection. Also, different antenna types are better suited to different uses of the Bluetooth-based system. If the main focus is the collection of travel time data, then an antenna with a lower sampling rate may provide more accurate travel time samples.",several approaches for travel time data collection based on the reading of timestamped media access control addresses from bluetoothenabled devices have been reported in the literature recently this new approach offers a number of advantages over more conventional methods including lower costs of hardware and software the volume of data that can be collected over time and ease of implementation a fundamental component that may affect the quantity and the quality of the travel time samples collected with a bluetoothbased system is the antenna type utilized antenna characteristics such as polarization and gain must be matched to specific application environments to optimize the performance of a bluetooth reader unit however experimental data that focuses on antenna characterization as it relates to the use of bluetooth technology to assess the performance of transportation facilities is lacking in this study five different types of antennas were characterized to assess their suitability to support a bluetoothbased travel time data collection system the results indicate that vertically polarized antennas with gains between dbi and dbi are good candidates for travel time data collection also different antenna types are better suited to different uses of the bluetoothbased system if the main focus is the collection of travel time data then an antenna with a lower sampling rate may provide more accurate travel time samples
15472450.2012.696449,10.1080/15472450.2012.696449,Fusing a Bluetooth Traffic Monitoring System With Loop Detector Data for Improved Freeway Traffic Speed Estimation,2013,152,164,37,2013-17-2,https://www.tandfonline.com/doi/full/10.1080/15472450.2012.696449,regular,fusing a bluetooth traffic monitoring system with loop detector data for improved freeway traffic speed estimation,"Anonymous probe vehicle monitoring systems are being developed to measure travel times on highways and arterials based on wireless signals available from technologies such as Bluetooth. Probe vehicle data can provide accurate measurements of current traffic speeds and travel times due to their excellent spatial coverage. However, presently probe vehicles are only a small portion of the vehicles that make up all of the traffic in the network. Alternatively, data from conventional loop detectors cover almost all the vehicles that have traveled along a road section, resulting in excellent temporal coverage. Unfortunately, loop detector measurements can be imprecise; their spatial sampling depends on the loop detector spacing, and they typically only represent traffic speed at the location of the detector and not over the entire road segment. With this complementarity in mind, this article explores several data fusion techniques for fusing data from these sources together. All methods are implemented and compared in terms of their ability to fuse data from loop detectors and probe vehicles to accurately estimate freeway traffic speeds. Data from a Bluetooth traffic monitoring system are fused with corresponding loop detector data and compared against GPS collected probe vehicle data on a stretch of Highway 401 in Toronto, Canada. The analysis shows that through data fusion, even a few probe vehicle measurements from a Bluetooth traffic monitoring system can improve the accuracy of traffic speed estimates traditionally obtained from loop detectors.",anonymous probe vehicle monitoring systems are being developed to measure travel times on highways and arterials based on wireless signals available from technologies such as bluetooth probe vehicle data can provide accurate measurements of current traffic speeds and travel times due to their excellent spatial coverage however presently probe vehicles are only a small portion of the vehicles that make up all of the traffic in the network alternatively data from conventional loop detectors cover almost all the vehicles that have traveled along a road section resulting in excellent temporal coverage unfortunately loop detector measurements can be imprecise; their spatial sampling depends on the loop detector spacing and they typically only represent traffic speed at the location of the detector and not over the entire road segment with this complementarity in mind this article explores several data fusion techniques for fusing data from these sources together all methods are implemented and compared in terms of their ability to fuse data from loop detectors and probe vehicles to accurately estimate freeway traffic speeds data from a bluetooth traffic monitoring system are fused with corresponding loop detector data and compared against gps collected probe vehicle data on a stretch of highway  in toronto canada the analysis shows that through data fusion even a few probe vehicle measurements from a bluetooth traffic monitoring system can improve the accuracy of traffic speed estimates traditionally obtained from loop detectors
15472450.2012.748555,10.1080/15472450.2012.748555,A Nonparametric Model for Short-Term Travel Time Prediction Using Bluetooth Data,2013,165,175,22,2013-17-2,https://www.tandfonline.com/doi/full/10.1080/15472450.2012.748555,regular,a nonparametric model for short term travel time prediction using bluetooth data,"Reliable travel time prediction enables both users and system controllers to be well informed of the future conditions on roadways. This in turn helps with informed pre-trip plans and effective traffic control strategies. This article studies short-time travel time prediction for stochastic freeway applications using real time Bluetooth travel time data. A set of four prediction models including historical average, auto-regressive integrated moving average (ARIMA), Kalman filter, and K-nearest neighbors (KNN), are implemented. A modified nonparametric model KNN-T is proposed that considers the traffic pattern features to enhance the basic KNN model with trend adjustment. The results of the prediction performances of each model from the case studies are investigated and reported. Results indicated that both nonparametric models, the basic KNN and KNN-T, outperformed the historical average, ARIMA, and Kalman filter models by decreasing the MAPE more than 10% for the all-day period and 20% for peak-hour periods in prediction accuracy. The proposed KNN-T model displayed 2.5% to 4.8% decrease in MAPE than KNN model for all-day and peak-hour periods, respectively, indicating that the KNN-T model captures not only the value but also the time-varying trend, which would lead to a more precise match with the future traffic conditions.",reliable travel time prediction enables both users and system controllers to be well informed of the future conditions on roadways this in turn helps with informed pretrip plans and effective traffic control strategies this article studies shorttime travel time prediction for stochastic freeway applications using real time bluetooth travel time data a set of four prediction models including historical average autoregressive integrated moving average  kalman filter and knearest neighbors  are implemented a modified nonparametric model knnt is proposed that considers the traffic pattern features to enhance the basic knn model with trend adjustment the results of the prediction performances of each model from the case studies are investigated and reported results indicated that both nonparametric models the basic knn and knnt outperformed the historical average arima and kalman filter models by decreasing the mape more than  for the allday period and  for peakhour periods in prediction accuracy the proposed knnt model displayed  to  decrease in mape than knn model for allday and peakhour periods respectively indicating that the knnt model captures not only the value but also the timevarying trend which would lead to a more precise match with the future traffic conditions
15472450.2012.712495,10.1080/15472450.2012.712495,A New Approach to Estimate Vehicle Emissions Using Inductive Loop Detector Data,2013,179,190,3,2013-17-3,https://www.tandfonline.com/doi/full/10.1080/15472450.2012.712495,regular,a new approach to estimate vehicle emissions using inductive loop detector data,"Motor vehicles are significant contributors to urban air pollution and greenhouse gases. Common practice for estimating vehicle emissions in California calls for integrating travel forecasting models and emission models. However, static travel forecasting models are incapable of generating the detailed vehicle activity required for emission estimates. Further, the fleet mix is also assumed to be constant across different roadways and at all times of day. Therefore, this article attempts to develop a new approach to measure travel activity and vehicle mix using existing inductive loop detector data. However, this study does not intend to forecast future vehicle activity. The study found that current practices overestimate speeds as much as 5–25 mph, whereas the proposed method overestimates speed about 2 mph, compared to ground-truth speeds in a freeway corridor. Furthermore, contrary to current practice, the proposed model distinguishes the vehicle miles traveled (VMT) between light-duty vehicles and heavy-duty vehicles in each link. The current practice overestimates or underestimates emissions by 1–20% during different times of day, whereas the proposed method underestimates the emissions by about 3%. We conclude that the proposed approach can provide a cost-effective way of estimating reliable emission inventory and estimating time-dependent emission inventories for different pollutants.",motor vehicles are significant contributors to urban air pollution and greenhouse gases common practice for estimating vehicle emissions in california calls for integrating travel forecasting models and emission models however static travel forecasting models are incapable of generating the detailed vehicle activity required for emission estimates further the fleet mix is also assumed to be constant across different roadways and at all times of day therefore this article attempts to develop a new approach to measure travel activity and vehicle mix using existing inductive loop detector data however this study does not intend to forecast future vehicle activity the study found that current practices overestimate speeds as much as  mph whereas the proposed method overestimates speed about  mph compared to groundtruth speeds in a freeway corridor furthermore contrary to current practice the proposed model distinguishes the vehicle miles traveled  between lightduty vehicles and heavyduty vehicles in each link the current practice overestimates or underestimates emissions by  during different times of day whereas the proposed method underestimates the emissions by about  we conclude that the proposed approach can provide a costeffective way of estimating reliable emission inventory and estimating timedependent emission inventories for different pollutants
15472450.2012.704338,10.1080/15472450.2012.704338,Prediction of Vehicle Activity for Emissions Estimation Under Oversaturated Conditions Along Signalized Arterials,2013,191,199,7,2013-17-3,https://www.tandfonline.com/doi/full/10.1080/15472450.2012.704338,regular,prediction of vehicle activity for emissions estimation under oversaturated conditions along signalized arterials,"The traditional methodology for estimating vehicle emissions based on vehicle miles traveled and average speed is not reliable because it does not consider the effects of congestion, control devices, and driving mode (cruise, acceleration, deceleration, and idle). We developed an analytical model to predict vehicle activity on signalized arterials with emphasis on oversaturated traffic conditions. The model depends only on loop detector data and signal settings as inputs and provides estimates of the time spent in each driving mode, which consequently leads to more accurate vehicle emission estimates. The application of the proposed model on a real-world arterial shows that it accurately estimates the time spent and consequently the emissions per driving mode. We also applied the model to evaluate the effectiveness of signal timing optimization in reducing vehicle emissions.",the traditional methodology for estimating vehicle emissions based on vehicle miles traveled and average speed is not reliable because it does not consider the effects of congestion control devices and driving mode  we developed an analytical model to predict vehicle activity on signalized arterials with emphasis on oversaturated traffic conditions the model depends only on loop detector data and signal settings as inputs and provides estimates of the time spent in each driving mode which consequently leads to more accurate vehicle emission estimates the application of the proposed model on a realworld arterial shows that it accurately estimates the time spent and consequently the emissions per driving mode we also applied the model to evaluate the effectiveness of signal timing optimization in reducing vehicle emissions
15472450.2012.716670,10.1080/15472450.2012.716670,Investigating Emission Reduction Benefit From Intersection Signal Optimization,2013,200,209,17,2013-17-3,https://www.tandfonline.com/doi/full/10.1080/15472450.2012.716670,regular,investigating emission reduction benefit from intersection signal optimization,"Most existing intersection signals are timed based on delay minimization. However, minimizing delay does not necessarily lead to the minimization of emissions at an intersection. No study has focused on the difference or the trade-off between delay based and emissions based signal optimization. Delay-based optimization typically uses macroscopic flow conditions such as traffic demands, saturation flow rates, and average delay. However, the latest emission model, MOVES (Motor Vehicle Emission Simulation), requires second-by-second individual vehicle speed profiles, which makes the model difficult to formulate directly in an emission-based signal optimization problem. This study first develops a methodology to derive vehicle profiles given macroscopic inputs so that MOVES can be applied to estimating emissions. Then an optimization methodology of signal timing is developed and solved with a genetic algorithm. The objective function of the optimization problem considers both delay and emissions, with the signal timing elements being the decision variables. Through a case study, the air quality benefit by reducing vehicle emissions through intersection signal control is demonstrated, and the trade-off between operational and emission performance measures is investigated. Furthermore, the air quality benefit from intersection signal control is discussed under different scenarios of cycle lengths, percentages of turning vehicles, and traffic demands on major/minor roads.",most existing intersection signals are timed based on delay minimization however minimizing delay does not necessarily lead to the minimization of emissions at an intersection no study has focused on the difference or the tradeoff between delay based and emissions based signal optimization delaybased optimization typically uses macroscopic flow conditions such as traffic demands saturation flow rates and average delay however the latest emission model moves  requires secondbysecond individual vehicle speed profiles which makes the model difficult to formulate directly in an emissionbased signal optimization problem this study first develops a methodology to derive vehicle profiles given macroscopic inputs so that moves can be applied to estimating emissions then an optimization methodology of signal timing is developed and solved with a genetic algorithm the objective function of the optimization problem considers both delay and emissions with the signal timing elements being the decision variables through a case study the air quality benefit by reducing vehicle emissions through intersection signal control is demonstrated and the tradeoff between operational and emission performance measures is investigated furthermore the air quality benefit from intersection signal control is discussed under different scenarios of cycle lengths percentages of turning vehicles and traffic demands on majorminor roads
