paper_id,doi,title,year,startpp,endpp,cited,issue_no,pdf_url,paper_type,title_pro,abstract,abstract_pro
15472450.2014.977049,10.1080/15472450.2014.977049,Joint Analysis of Queuing Delays Associated With Secondary Incidents,2015,192,204,6,2015-19-2,https://www.tandfonline.com/doi/full/10.1080/15472450.2014.977049,regular,joint analysis of queuing delays associated with secondary incidents,"Incidents cause substantial travel delays on urban freeways. Travel delays due to incidents are typically estimated for each incident independently. However, when multiple incidents occur on the same stretch of a roadway, treating them independently and ignoring their interactions leads to inaccurate results, which ultimately may lead to inefficient incident management strategies. This study examines delays due to primary–secondary incident pairs that occur on the same stretch of a freeway within a short time gap. Depending on their correlation in time and space, they can have varying degrees of impacts on the traffic flow. This article assesses the total delays induced by primary–secondary incident pairs by jointly modeling their occurrences. First, incident data combined with roadway inventory data from Hampton Roads, Virginia, are analyzed to understand the attributes of primary–secondary incident pairs, e.g., durations, lane blockages, and time gaps (between start times of the primary and its secondary incidents). Then using microscopic simulation as a primary evaluation tool, the effects of three critical parameters are investigated: time gap, distance between primary and secondary incidents, and traffic demand level. The historical incident analysis shows that, on average, primary–secondary incident pairs have substantially longer durations than single incidents. The joint analysis of queuing delays induced by primary incident and its secondary incident suggests that time gap and distance between a primary incident and its secondary incident are significantly associated with the total delays after controlling for other factors (e.g., the two associated incidents’ durations and lane blockages). Furthermore, based on the scenarios tested (i.e., two incidents both blocking the right lane in a three-lane basic freeway section), it is found that the sum of delays induced by a primary incident and its secondary incident separately will over- or underestimate the actual delays. For those secondary incidents that end after their associated primary incidents, total delays increase as time gap increases; increasing the distance between primary and secondary incidents is associated with reduction in delays. Other results and the implications of the findings for traffic operations are presented in the article.",incidents cause substantial travel delays on urban freeways travel delays due to incidents are typically estimated for each incident independently however when multiple incidents occur on the same stretch of a roadway treating them independently and ignoring their interactions leads to inaccurate results which ultimately may lead to inefficient incident management strategies this study examines delays due to primarysecondary incident pairs that occur on the same stretch of a freeway within a short time gap depending on their correlation in time and space they can have varying degrees of impacts on the traffic flow this article assesses the total delays induced by primarysecondary incident pairs by jointly modeling their occurrences first incident data combined with roadway inventory data from hampton roads virginia are analyzed to understand the attributes of primarysecondary incident pairs eg durations lane blockages and time gaps  then using microscopic simulation as a primary evaluation tool the effects of three critical parameters are investigated time gap distance between primary and secondary incidents and traffic demand level the historical incident analysis shows that on average primarysecondary incident pairs have substantially longer durations than single incidents the joint analysis of queuing delays induced by primary incident and its secondary incident suggests that time gap and distance between a primary incident and its secondary incident are significantly associated with the total delays after controlling for other factors  furthermore based on the scenarios tested  it is found that the sum of delays induced by a primary incident and its secondary incident separately will over or underestimate the actual delays for those secondary incidents that end after their associated primary incidents total delays increase as time gap increases; increasing the distance between primary and secondary incidents is associated with reduction in delays other results and the implications of the findings for traffic operations are presented in the article
15472450.2014.977046,10.1080/15472450.2014.977046,Automatic Incident Detection for Urban Expressways Based on Segment Traffic Flow Density,2015,205,213,5,2015-19-2,https://www.tandfonline.com/doi/full/10.1080/15472450.2014.977046,regular,automatic incident detection for urban expressways based on segment traffic flow density,"Urban expressways play an important role in urban road networks. Although automatic incident detection (AID) methods have been studied for a long time, most of the existing AID algorithms are designed for freeways and do not explicitly consider the detection of incidents near ramps with frequent in and out weaving flows. Urban expressways usually have short spaced ramps, which makes the traffic flow characterizations quite different from the ones of freeways. In addition, expressways usually have heavy traffic flow, which makes it more difficult to distinguish incidents from congestion. This article presents an AID method for urban expressways, using loop detector data. Based on the geometric conditions and detector locations, the expressway is divided into short segments. The equivalent upstream and downstream traffic flow density difference is defined and calculated using the loop detector data. A detection logic based on the pattern of the density difference fluctuation is then proposed. The performance of the proposed algorithm was tested using real incident data from a corridor of the Shanghai expressway and compared with two classic AID algorithms. The results indicate that this method performs very well and is suitable for urban expressways.",urban expressways play an important role in urban road networks although automatic incident detection  methods have been studied for a long time most of the existing aid algorithms are designed for freeways and do not explicitly consider the detection of incidents near ramps with frequent in and out weaving flows urban expressways usually have short spaced ramps which makes the traffic flow characterizations quite different from the ones of freeways in addition expressways usually have heavy traffic flow which makes it more difficult to distinguish incidents from congestion this article presents an aid method for urban expressways using loop detector data based on the geometric conditions and detector locations the expressway is divided into short segments the equivalent upstream and downstream traffic flow density difference is defined and calculated using the loop detector data a detection logic based on the pattern of the density difference fluctuation is then proposed the performance of the proposed algorithm was tested using real incident data from a corridor of the shanghai expressway and compared with two classic aid algorithms the results indicate that this method performs very well and is suitable for urban expressways
15472450.2013.836930,10.1080/15472450.2013.836930,Optimizing Single-Depot Vehicle Scheduling Problem: Fixed-Interval Model and Algorithm,2015,215,224,5,2015-19-3,https://www.tandfonline.com/doi/full/10.1080/15472450.2013.836930,regular,optimizing single depot vehicle scheduling problem  fixed interval model and algorithm,"Intelligent transportation systems (ITS) play an important role in public transit. This study addresses modeling and algorithm for the optimal single-depot vehicle scheduling problem (SDVSP) in the intelligent public transit operation, which has been implemented successfully in practice. The problem is formulated as a fixed-interval scheduling model in accord with job shop scheduling theory, which aims to assign ideal jobs to machines at appropriate times to maximize production in computer science or industrial engineering. This model allows transportation engineers to make use of those out-of-the-box theories and solution methods already developed for fixed-interval scheduling problems. In this article, the SDVSP with multiple vehicle types is established as a non-preemptive online multiprocessor-task fixed-interval scheduling model. As conventional solution methods for solving fixed interval scheduling problems are no longer available for the proposed model, this article develops the algorithm based on the FIFO (first in, first out) rule to find the optimal vehicle scheduling solution, and the optimal criterion is proved via competitive analysis. A case study is carried out to evaluate the proposed methodology by using field data collected from one transit system.",intelligent transportation systems  play an important role in public transit this study addresses modeling and algorithm for the optimal singledepot vehicle scheduling problem  in the intelligent public transit operation which has been implemented successfully in practice the problem is formulated as a fixedinterval scheduling model in accord with job shop scheduling theory which aims to assign ideal jobs to machines at appropriate times to maximize production in computer science or industrial engineering this model allows transportation engineers to make use of those outofthebox theories and solution methods already developed for fixedinterval scheduling problems in this article the sdvsp with multiple vehicle types is established as a nonpreemptive online multiprocessortask fixedinterval scheduling model as conventional solution methods for solving fixed interval scheduling problems are no longer available for the proposed model this article develops the algorithm based on the fifo  rule to find the optimal vehicle scheduling solution and the optimal criterion is proved via competitive analysis a case study is carried out to evaluate the proposed methodology by using field data collected from one transit system
15472450.2013.856724,10.1080/15472450.2013.856724,A Lane Assessment Method Using Visual Information Based on a Dynamic Bayesian Network,2015,225,239,2,2015-19-3,https://www.tandfonline.com/doi/full/10.1080/15472450.2013.856724,regular,a lane assessment method using visual information based on a dynamic bayesian network,"The perception and the interpretation of the vehicle's surrounding are the core modules in any advanced driving assistance system, and the first two stages of every autonomous driving solution. The purpose of the perception stage is to assess the state of the relevant objects (objects’ positions, shape, class, orientation, speed) using the primary sensorial information. The purpose of the interpretation stage is to use the objects assessment in order to achieve situation assessment, that is, identification of the instantaneous relations between the traffic environment elements as well as their evolution in time. The work presented in this article lies within the interpretation layer; our aim is to identify on which of the road's lanes is the ego-vehicle currently traveling. We refer to the own vehicle as the ego-vehicle and to its current driving lane as the ego-lane. The ego-vehicle is equipped with a stereovision perception system, and the proposed solution is to identify the ego-lane number by matching the visually detected lane landmarks with the corresponding map landmarks, available from an original extended digital map. Additionally, the visually detected vehicles are used for ego-lane number identification. The proposed solution is a probabilistic one, in the form of a Bayesian network, which uses as evidence the visual cues provided by the stereovision perception system. In order to incorporate the dynamic nature of the problem, a temporal dimension was added to the network, resulting in a dynamic Bayesian model. Experimental results illustrate the efficiency of the proposed method in complex situations, and the improved efficiency of the dynamic approach over the static one.",the perception and the interpretation of the vehicles surrounding are the core modules in any advanced driving assistance system and the first two stages of every autonomous driving solution the purpose of the perception stage is to assess the state of the relevant objects  using the primary sensorial information the purpose of the interpretation stage is to use the objects assessment in order to achieve situation assessment that is identification of the instantaneous relations between the traffic environment elements as well as their evolution in time the work presented in this article lies within the interpretation layer; our aim is to identify on which of the roads lanes is the egovehicle currently traveling we refer to the own vehicle as the egovehicle and to its current driving lane as the egolane the egovehicle is equipped with a stereovision perception system and the proposed solution is to identify the egolane number by matching the visually detected lane landmarks with the corresponding map landmarks available from an original extended digital map additionally the visually detected vehicles are used for egolane number identification the proposed solution is a probabilistic one in the form of a bayesian network which uses as evidence the visual cues provided by the stereovision perception system in order to incorporate the dynamic nature of the problem a temporal dimension was added to the network resulting in a dynamic bayesian model experimental results illustrate the efficiency of the proposed method in complex situations and the improved efficiency of the dynamic approach over the static one
15472450.2013.856727,10.1080/15472450.2013.856727,Reliability of Bluetooth Technology for Travel Time Estimation,2015,240,255,17,2015-19-3,https://www.tandfonline.com/doi/full/10.1080/15472450.2013.856727,regular,reliability of bluetooth technology for travel time estimation,"A unique Bluetooth-enabled device may be detected several times or not at all when it passes a sensor location. This depends mainly on the strength and speed of a transmitting device, discovery procedure, location of the device relative to the Bluetooth sensor, the Bluetooth sensor's ping cycle (0.1 s), the size and shape of the sensor's detection zone, and the time span for which the Bluetooth-enabled device is within the detection zone. The influences of size of Bluetooth sensor detection zones and Bluetooth discovery procedure on multiple detection events have been mentioned in previous research. However, their corresponding impacts on accuracy and reliability of estimated travel time have not been evaluated. In this study, a controlled field experiment is conducted to collect both Bluetooth and global positioning system (GPS) data for 1000 trips to be used as the basis for evaluation. Data obtained by GPS logger are used to calculate actual travel time, referred to as ground truth, and to geo-code the Bluetooth detection events. In this setting, reliability is defined as the percentage of devices captured per trip during the experiment. It is found that, on average, Bluetooth-enabled devices will be detected 80% of the time while passing a sensor location. The impact of location ambiguity caused by the size of the detection zone is evaluated using geo-coded Bluetooth data. Results show that more than 80% of the detection events are recorded within the range of 100 m from the sensor center line. It is also shown that short-range antennas detect Bluetooth-enabled devices in a location closer to the sensor, thus providing a more accurate travel time estimate. However, the smaller the size of the detection zone, the lower is the penetration rate, which could itself influence the accuracy of estimates. Therefore, there has to be a trade-off between acceptable level of location ambiguity and penetration rate for configuration and coverage of the antennas.",a unique bluetoothenabled device may be detected several times or not at all when it passes a sensor location this depends mainly on the strength and speed of a transmitting device discovery procedure location of the device relative to the bluetooth sensor the bluetooth sensors ping cycle  the size and shape of the sensors detection zone and the time span for which the bluetoothenabled device is within the detection zone the influences of size of bluetooth sensor detection zones and bluetooth discovery procedure on multiple detection events have been mentioned in previous research however their corresponding impacts on accuracy and reliability of estimated travel time have not been evaluated in this study a controlled field experiment is conducted to collect both bluetooth and global positioning system  data for  trips to be used as the basis for evaluation data obtained by gps logger are used to calculate actual travel time referred to as ground truth and to geocode the bluetooth detection events in this setting reliability is defined as the percentage of devices captured per trip during the experiment it is found that on average bluetoothenabled devices will be detected  of the time while passing a sensor location the impact of location ambiguity caused by the size of the detection zone is evaluated using geocoded bluetooth data results show that more than  of the detection events are recorded within the range of m from the sensor center line it is also shown that shortrange antennas detect bluetoothenabled devices in a location closer to the sensor thus providing a more accurate travel time estimate however the smaller the size of the detection zone the lower is the penetration rate which could itself influence the accuracy of estimates therefore there has to be a tradeoff between acceptable level of location ambiguity and penetration rate for configuration and coverage of the antennas
15472450.2013.857197,10.1080/15472450.2013.857197,Kinematic Equation-Based Vehicle Queue Location Estimation Method for Signalized Intersections Using Mobile Sensor Data,2015,256,272,22,2015-19-3,https://www.tandfonline.com/doi/full/10.1080/15472450.2013.857197,regular,kinematic equation based vehicle queue location estimation method for signalized intersections using mobile sensor data,"This article presents methods to estimate the location of a vehicle in the queue based on the vehicle's travel time traversing a signalized intersection. The methods focus on the queue discharging process, and calculate the location (in the queue) and acceleration rate of the vehicle simultaneously using kinematic equations. If such location information can be calculated for multiple sampled vehicles in a cycle, the dynamic profile of queue length of the cycle can be estimated. By using travel times, the methods can be applied to data collected via many newly emerged traffic data collection systems such as mobile sensors. The proposed methods are tested using data from simulation, a field experiment, and the Next Generation Simulation (NGSIM), and are compared with a previously developed queue length method.",this article presents methods to estimate the location of a vehicle in the queue based on the vehicles travel time traversing a signalized intersection the methods focus on the queue discharging process and calculate the location  and acceleration rate of the vehicle simultaneously using kinematic equations if such location information can be calculated for multiple sampled vehicles in a cycle the dynamic profile of queue length of the cycle can be estimated by using travel times the methods can be applied to data collected via many newly emerged traffic data collection systems such as mobile sensors the proposed methods are tested using data from simulation a field experiment and the next generation simulation  and are compared with a previously developed queue length method
15472450.2014.892380,10.1080/15472450.2014.892380,A Bilevel Traffic Data Extraction Procedure via Cellular Phone Network for Intercity Travel,2015,289,303,5,2015-19-3,https://www.tandfonline.com/doi/full/10.1080/15472450.2014.892380,regular,a bilevel traffic data extraction procedure via cellular phone network for intercity travel,"The absence of traffic surveillance infrastructure, in many developing countries, hinders any efforts for dealing with the daily witnessed traffic chaos. The use of the cellular phone (CP) network data for traffic data collection is a promising option for large-scale coverage, given a high CP penetration rate. This article presents a bilevel procedure for the extraction of classified vehicular traffic counts for different vehicle types, in a given roadway segment, for intercity travel. The bilevel procedure operates in an offline setting, independent from any secondary traffic surveillance system. At the first level, cellular phones on board the same vehicle are clustered using a “data swarm clustering” algorithm. At the second level, a genetic fuzzy classifier (GFC) is used for vehicles classification. The development and testing of the proposed procedure was conducted using a traffic/CP simulation platform. At the development phase, the swarm-based clustering algorithm achieved 93% clustering accuracy (vehicle count accuracy). At the second level, the fuzzy classifier successfully classified around 85% of the vehicles. The procedure was further evaluated using a microsimulation model of a major travel corridor in the Greater Cairo Region, Egypt. Superior performance was achieved, at the clustering level, with an accuracy of 97.6%. The revealed accuracy demonstrates the efficiency of the developed procedure for extracting unclassified vehicular counts from CP data. At the classification level, accuracy was reduced to 70.6 ± 11.5%. Achieved classification results are promising from a conceptual perspective. Nevertheless, further investigation is crucial for enhanced classification performance and robustness.",the absence of traffic surveillance infrastructure in many developing countries hinders any efforts for dealing with the daily witnessed traffic chaos the use of the cellular phone  network data for traffic data collection is a promising option for largescale coverage given a high cp penetration rate this article presents a bilevel procedure for the extraction of classified vehicular traffic counts for different vehicle types in a given roadway segment for intercity travel the bilevel procedure operates in an offline setting independent from any secondary traffic surveillance system at the first level cellular phones on board the same vehicle are clustered using a data swarm clustering algorithm at the second level a genetic fuzzy classifier  is used for vehicles classification the development and testing of the proposed procedure was conducted using a trafficcp simulation platform at the development phase the swarmbased clustering algorithm achieved  clustering accuracy  at the second level the fuzzy classifier successfully classified around  of the vehicles the procedure was further evaluated using a microsimulation model of a major travel corridor in the greater cairo region egypt superior performance was achieved at the clustering level with an accuracy of  the revealed accuracy demonstrates the efficiency of the developed procedure for extracting unclassified vehicular counts from cp data at the classification level accuracy was reduced to    achieved classification results are promising from a conceptual perspective nevertheless further investigation is crucial for enhanced classification performance and robustness
