paper_id,doi,title,year,startpp,endpp,cited,issue_no,pdf_url,paper_type,title_pro,abstract,abstract_pro
15472450.2018.1441027,10.1080/15472450.2018.1441027,Comparison of vehicle re-identification models for trucks based on axle spacing measurements,2018,517,529,1,2018-22-6,https://www.tandfonline.com/doi/full/10.1080/15472450.2018.1441027,regular,comparison of vehicle re identification models for trucks based on axle spacing measurements,ABSTRACT,abstract
15472450.2018.1444484,10.1080/15472450.2018.1444484,Using trajectory data to explore roadway characterization for bikeshare network,2018,530,546,2,2018-22-6,https://www.tandfonline.com/doi/full/10.1080/15472450.2018.1444484,regular,using trajectory data to explore roadway characterization for bikeshare network,ABSTRACT,abstract
15472450.2018.1444485,10.1080/15472450.2018.1444485,Investigation of stochastic variation of parameters for a macroscopic traffic model,2018,547,564,2,2018-22-6,https://www.tandfonline.com/doi/full/10.1080/15472450.2018.1444485,regular,investigation of stochastic variation of parameters for a macroscopic traffic model,ABSTRACT,abstract
15472450.2018.1473156,10.1080/15472450.2018.1473156,Analyzing travel time reliability and its influential factors of emergency vehicles with generalized extreme value theory,2019,1,11,2,2019-23-1,https://www.tandfonline.com/doi/full/10.1080/15472450.2018.1473156,regular,analyzing travel time reliability and its influential factors of emergency vehicles with generalized extreme value theory,ABSTRACT,abstract
15472450.2018.1476146,10.1080/15472450.2018.1476146,Platoon recognition using connected vehicle technology,2019,12,27,2,2019-23-1,https://www.tandfonline.com/doi/full/10.1080/15472450.2018.1476146,regular,platoon recognition using connected vehicle technology,ABSTRACT,abstract
15472450.2018.1484738,10.1080/15472450.2018.1484738,Modeling arterial travel time distribution by accounting for link correlations: a copula-based approach,2019,28,40,5,2019-23-1,https://www.tandfonline.com/doi/full/10.1080/15472450.2018.1484738,regular,modeling arterial travel time distribution by accounting for link correlations  a copula based approach,"The estimation of urban arterial travel time distribution (TTD) is critical to help implement Intelligent Transportation Systems (ITS) and provide travelers with timely and reliable route guidance. The state-of-practice procedure for arterial TTD estimation commonly assumes that the path travel time follows a certain distribution without considering link correlations. However, this approach appears inappropriate since travel times on successive links are essentially dependent along signalized arterials. In this study, a copula-based approach is proposed to model arterial TTD by accounting for spatial link correlations. First, TTDs on consecutive links along one arterial in Hangzhou, China are investigated. Link TTDs are estimated through the nonparametric kernel smoothing method. Link correlations are analyzed in both unfavorable and favorable coordination cases. Then, Gaussian copula models are introduced to model the dependent structure between link TTDs. The parameters of Gaussian copula are obtained by Maximum-Likelihood Estimation (MLE). Next, path TTDs covering consecutive links are estimated based on the estimated copula models. The results demonstrate the advantage of the proposed copula-based approach, compared with the convolution without capturing link correlations and the empirical distribution fitting methods in both unfavorable and favorable coordination cases.",the estimation of urban arterial travel time distribution  is critical to help implement intelligent transportation systems  and provide travelers with timely and reliable route guidance the stateofpractice procedure for arterial ttd estimation commonly assumes that the path travel time follows a certain distribution without considering link correlations however this approach appears inappropriate since travel times on successive links are essentially dependent along signalized arterials in this study a copulabased approach is proposed to model arterial ttd by accounting for spatial link correlations first ttds on consecutive links along one arterial in hangzhou china are investigated link ttds are estimated through the nonparametric kernel smoothing method link correlations are analyzed in both unfavorable and favorable coordination cases then gaussian copula models are introduced to model the dependent structure between link ttds the parameters of gaussian copula are obtained by maximumlikelihood estimation  next path ttds covering consecutive links are estimated based on the estimated copula models the results demonstrate the advantage of the proposed copulabased approach compared with the convolution without capturing link correlations and the empirical distribution fitting methods in both unfavorable and favorable coordination cases
15472450.2018.1493929,10.1080/15472450.2018.1493929,A framework for short-term traffic flow forecasting using the combination of wavelet transformation and artificial neural networks,2019,60,71,5,2019-23-1,https://www.tandfonline.com/doi/full/10.1080/15472450.2018.1493929,regular,a framework for short term traffic flow forecasting using the combination of wavelet transformation and artificial neural networks,"The main objective of this paper is to develop a framework for short-term traffic flow forecasting models with high accuracy. Due to flow oscillations, the real-time information presented to the drivers through variable message signs, etc., may not be valid by the time the driver reaches the location. On the other hand, not all compartments of the flow signal are of same importance in determining its future state. A model is developed to predict the value of traffic flow in near future (next 5–35 minutes) based on the combination of wavelet transformation and artificial neural networks. This model is called the hybrid WT-ANN. Wavelet transformation is set to denoise the flow signal, i.e., filtering the unimportant fluctuations of the flow signal. Unimportant fluctuations are those that have little or no effect on the future condition of the signal. The neural network is set and trained to use previous data for predicting future flow. To implement the system, traffic data of US-101 were used from Next Generation Simulation (NGSIM). Results show that removing the noises has improved the accuracy of the prediction to a great extent. The model was used to predict the flow in three different locations on the same highway and a different highway in a different country. The model rendered highly reliable predictions. The proposed model predicts the flow of next 5 min on the same location with 2.5% Mean Absolute Percentage Error (MAPE) and of next 35 min with less than 12% MAPE. It predicts the flow on downstream locations for next 5 min with less than 8% MAPE and for the different highway with 2.3% MAPE.",the main objective of this paper is to develop a framework for shortterm traffic flow forecasting models with high accuracy due to flow oscillations the realtime information presented to the drivers through variable message signs etc may not be valid by the time the driver reaches the location on the other hand not all compartments of the flow signal are of same importance in determining its future state a model is developed to predict the value of traffic flow in near future  based on the combination of wavelet transformation and artificial neural networks this model is called the hybrid wtann wavelet transformation is set to denoise the flow signal ie filtering the unimportant fluctuations of the flow signal unimportant fluctuations are those that have little or no effect on the future condition of the signal the neural network is set and trained to use previous data for predicting future flow to implement the system traffic data of us were used from next generation simulation  results show that removing the noises has improved the accuracy of the prediction to a great extent the model was used to predict the flow in three different locations on the same highway and a different highway in a different country the model rendered highly reliable predictions the proposed model predicts the flow of next min on the same location with  mean absolute percentage error  and of next min with less than  mape it predicts the flow on downstream locations for next min with less than  mape and for the different highway with  mape
15472450.2018.1506338,10.1080/15472450.2018.1506338,A similarity-based neuro-fuzzy modeling for driving behavior recognition applying fusion of smartphone sensors,2019,72,83,8,2019-23-1,https://www.tandfonline.com/doi/full/10.1080/15472450.2018.1506338,regular,a similarity based neuro fuzzy modeling for driving behavior recognition applying fusion of smartphone sensors,"Drivers’ behavior evaluation is one of the most important problems in intelligent transportation systems and driver assistant systems. It has a great influence on driving safety and fuel consumption. One of the challenges in this regard is the modeling perspective to treat with uncertainty in judgments about driving behaviors. Really, assessing a single maneuver with a rigid threshold leads to a weak judgment for driving evaluation. To fill this gap, a novel neuro-fuzzy system is proposed to classify the driving behaviors based on their similarities to fuzzy patterns when all of the various maneuvers are stated with some fuzzy numbers. These patterns are also fuzzy numbers and they are extracted from statistical analysis on the smartphone sensors data. Our driving evaluation system consists of three processes. Firstly, it detects the type of all of the maneuvers through the driving period, by using a multi-layer perceptron neural network. Secondly, it extracts a new feature based on the acceleration and assigns three fuzzy numbers to driver’s lane change, turn and U-turn maneuvers. Thirdly, it determines the similarity between these three fuzzy numbers and the fuzzy patterns to evaluate the safe and the aggressive driving scores. To validate this model, Driver’s Angry Score (DAS) questionnaires are used. Results show that the fusion of Inertial Measurement Unit (IMU) sensors of smartphones is enough for the proposed driving evaluation system. Accuracy of this system is 87% without using GPS and GIS data and this system is independent of smartphones and vehicles types.",drivers behavior evaluation is one of the most important problems in intelligent transportation systems and driver assistant systems it has a great influence on driving safety and fuel consumption one of the challenges in this regard is the modeling perspective to treat with uncertainty in judgments about driving behaviors really assessing a single maneuver with a rigid threshold leads to a weak judgment for driving evaluation to fill this gap a novel neurofuzzy system is proposed to classify the driving behaviors based on their similarities to fuzzy patterns when all of the various maneuvers are stated with some fuzzy numbers these patterns are also fuzzy numbers and they are extracted from statistical analysis on the smartphone sensors data our driving evaluation system consists of three processes firstly it detects the type of all of the maneuvers through the driving period by using a multilayer perceptron neural network secondly it extracts a new feature based on the acceleration and assigns three fuzzy numbers to drivers lane change turn and uturn maneuvers thirdly it determines the similarity between these three fuzzy numbers and the fuzzy patterns to evaluate the safe and the aggressive driving scores to validate this model drivers angry score  questionnaires are used results show that the fusion of inertial measurement unit  sensors of smartphones is enough for the proposed driving evaluation system accuracy of this system is  without using gps and gis data and this system is independent of smartphones and vehicles types
15472450.2018.1527693,10.1080/15472450.2018.1527693,A hybrid dead reckoning error correction scheme based on extended Kalman filter and map matching for vehicle self-localization,2019,84,98,2,2019-23-1,https://www.tandfonline.com/doi/full/10.1080/15472450.2018.1527693,regular,a hybrid dead reckoning error correction scheme based on extended kalman filter and map matching for vehicle self localization,"In this research, a hybrid dead reckoning error correction scheme is developed based on extended Kalman filter (EKF) and map matching (MM) to improve the positioning accuracy for vehicle self-localization. The developed method aims at obtaining accurate positions when the GPS signals are occasionally unavailable or weakened. First, the heading data collected from an odometer and an optical fiber gyroscope are integrated by an EKF to reduce the random errors in dead reckoning. Then a modified topological MM algorithm is developed to reduce the systematic errors in dead reckoning. In this work, both cross-track errors and along-track errors are considered to improve positioning accuracy of MM. The errors are finally corrected using the results achieved from both the dead reckoning and the MM when the driving distance of a vehicle exceeds a predefined length or the vehicle turns in an intersection. Experiments have been conducted to evaluate the developed method and the results show that the maximum error and average error of dead reckoning can be respectively reduced to 15.4 m and 5.2 m during the experiment with total distance of 43 km. This positioning accuracy is even better than the accuracy of the low-cost GPSs which are usually at the order of 15–20 m (95%). The developed method is effective to achieve the positions of the vehicle when the GPS signals are occasionally unavailable or weakened.",in this research a hybrid dead reckoning error correction scheme is developed based on extended kalman filter  and map matching  to improve the positioning accuracy for vehicle selflocalization the developed method aims at obtaining accurate positions when the gps signals are occasionally unavailable or weakened first the heading data collected from an odometer and an optical fiber gyroscope are integrated by an ekf to reduce the random errors in dead reckoning then a modified topological mm algorithm is developed to reduce the systematic errors in dead reckoning in this work both crosstrack errors and alongtrack errors are considered to improve positioning accuracy of mm the errors are finally corrected using the results achieved from both the dead reckoning and the mm when the driving distance of a vehicle exceeds a predefined length or the vehicle turns in an intersection experiments have been conducted to evaluate the developed method and the results show that the maximum error and average error of dead reckoning can be respectively reduced to m and m during the experiment with total distance of km this positioning accuracy is even better than the accuracy of the lowcost gpss which are usually at the order of m  the developed method is effective to achieve the positions of the vehicle when the gps signals are occasionally unavailable or weakened
15472450.2018.1502667,10.1080/15472450.2018.1502667,"Quantitative analysis of probe data characteristics: Coverage, speed bias and congestion detection precision",2019,103,119,5,2019-23-2,https://www.tandfonline.com/doi/full/10.1080/15472450.2018.1502667,regular,quantitative analysis of probe data characteristics  coverage  speed bias and congestion detection precision,"In recent years, there has been a growing desire for the use of probe vehicle technology for congestion detection and general infrastructure performance assessment. Unlike costly traditional data collection by loop detectors, wide area detection using probe-based traffic data is significantly different in terms of the nature of data collection, measurement technique, coverage, pricing, and so on. Although many researches have studied probe-based data, there remains critical questions such as data coverage and penetration over time, or the influential factors in the accuracy of probe data. This research studied probe-sourced data from INRIX, to profoundly explore some of these questions. First, to explore coverage and penetration, INRIX real-time data was illustrated temporally over the entire state of Iowa, demonstrating the growth in real-time data over a 4-year timespan. Furthermore, the availability of INRIX real-time and historical data based on type of road and time of day, were explored. Second, a comparison was made with Wavetronix smart sensors, commonly used sensors in traffic management, to explore INRIX’s speed data quality. A statistical analysis on the behavior of INRIX speed bias, identified some of the influential factors in defining the magnitude of speed bias. Finally, the accuracy and reliability of INRIX for congestion detection purposes was investigated based on the road segment characteristics and the congestion type. Overall, this work sheds light onto some of the less explored aspects of INRIX probe-based data to help traffic managers and decision makers in better understanding this source of data and any resultant analyses.",in recent years there has been a growing desire for the use of probe vehicle technology for congestion detection and general infrastructure performance assessment unlike costly traditional data collection by loop detectors wide area detection using probebased traffic data is significantly different in terms of the nature of data collection measurement technique coverage pricing and so on although many researches have studied probebased data there remains critical questions such as data coverage and penetration over time or the influential factors in the accuracy of probe data this research studied probesourced data from inrix to profoundly explore some of these questions first to explore coverage and penetration inrix realtime data was illustrated temporally over the entire state of iowa demonstrating the growth in realtime data over a year timespan furthermore the availability of inrix realtime and historical data based on type of road and time of day were explored second a comparison was made with wavetronix smart sensors commonly used sensors in traffic management to explore inrixs speed data quality a statistical analysis on the behavior of inrix speed bias identified some of the influential factors in defining the magnitude of speed bias finally the accuracy and reliability of inrix for congestion detection purposes was investigated based on the road segment characteristics and the congestion type overall this work sheds light onto some of the less explored aspects of inrix probebased data to help traffic managers and decision makers in better understanding this source of data and any resultant analyses
15472450.2018.1486192,10.1080/15472450.2018.1486192,Bayesian network for red-light-running prediction at signalized intersections,2019,120,132,5,2019-23-2,https://www.tandfonline.com/doi/full/10.1080/15472450.2018.1486192,regular,bayesian network for red light running prediction at signalized intersections,"Red-light-running (RLR) is an important reason for the large number of intersection-related fatalities, injuries, and other losses. The accurate RLR prediction can effectively reduce crashes caused by RLR behavior. The RLR prediction is usually composed of two parts: the vehicle’s stop-or-go behavior and the arrival time when the vehicle reaches the stop line. Previous stop-or-go prediction models are usually based on embedded traffic sensors using machine learning algorithms. While based on the continuous trajectories collected by radar sensors, RLR prediction can be conducted more effectively. In this paper, a probabilistic stop-or-go prediction model based on the Bayesian network (BN) is proposed for RLR prediction. We extend the deterministic output into the probabilistic output, which provides decision-makers with greater autonomy. The causality of BN improves the interpretability of the prediction model. The BN model is calibrated and tested by the continuous trajectories data measured by radar sensors installed at a signalized intersection. We not only consider the movement measurements of individual vehicles (e.g., speed and acceleration), but also take into account the car-following behavior. As a comparison, different machine learning models and the model based on the inductive loop detection (ILD) are adopted. The results show that the proposed BN model has a high prediction accuracy and performs better in the feature interpretation. This paper provides a new way for probabilistic RLR prediction based on continuous trajectories, which will significantly improve traffic safety of signalized intersections.",redlightrunning  is an important reason for the large number of intersectionrelated fatalities injuries and other losses the accurate rlr prediction can effectively reduce crashes caused by rlr behavior the rlr prediction is usually composed of two parts the vehicles stoporgo behavior and the arrival time when the vehicle reaches the stop line previous stoporgo prediction models are usually based on embedded traffic sensors using machine learning algorithms while based on the continuous trajectories collected by radar sensors rlr prediction can be conducted more effectively in this paper a probabilistic stoporgo prediction model based on the bayesian network  is proposed for rlr prediction we extend the deterministic output into the probabilistic output which provides decisionmakers with greater autonomy the causality of bn improves the interpretability of the prediction model the bn model is calibrated and tested by the continuous trajectories data measured by radar sensors installed at a signalized intersection we not only consider the movement measurements of individual vehicles  but also take into account the carfollowing behavior as a comparison different machine learning models and the model based on the inductive loop detection  are adopted the results show that the proposed bn model has a high prediction accuracy and performs better in the feature interpretation this paper provides a new way for probabilistic rlr prediction based on continuous trajectories which will significantly improve traffic safety of signalized intersections
